{
  "$schema": "https://raw.githubusercontent.com/YOUR_ORG/shiplog/main/plugins/shiplog/skills/shiplog/schema/release.schema.json",
  "version": "0.2.0",
  "date": "2026-09-28",
  "summary": "Slack announcements, faster drafting, archive pages and audience feeds",
  "entries": [
    {
      "type": "added",
      "title": "Announce releases in Slack",
      "description": "After a release is published, Shiplog can post it to one or more Slack channels. Each channel only gets the changes for its audiences, and action-required changes come first with their deadline. You see a preview of every message and nothing is sent until you confirm. Webhook URLs and tokens stay in environment variables or CI secrets, never in the repository.",
      "audiences": ["skill-users", "ci-maintainers"],
      "action_required": false,
      "links": [{"label": "Slack setup guide", "url": "https://github.com/YOUR_ORG/shiplog/blob/main/plugins/shiplog/skills/shiplog/references/slack.md"}],
      "refs": ["notify.py"]
    },
    {
      "type": "added",
      "title": "Import an existing CHANGELOG.md",
      "description": "Ask Claude to import your Keep a Changelog file and each version becomes a Shiplog release. Old entries don't say who is affected, so every imported entry is marked for review, and the validator lists them until you confirm the impact.",
      "audiences": ["skill-users"],
      "action_required": false,
      "refs": ["import_changelog.py"]
    },
    {
      "type": "added",
      "title": "A feed for each audience",
      "description": "Besides the main feed, each audience now gets its own Atom feed with only the changes that affect it, plus changes for everyone. The changelog page links to all of them, so admins can subscribe to admin changes only.",
      "audiences": ["skill-users"],
      "action_required": false
    },
    {
      "type": "added",
      "title": "Translate the changelog page and get link previews",
      "description": "Every label on the page, including month names and the date format, can be translated in the config. Pages now include Open Graph and canonical tags, so links shared in chat or social apps show a proper preview.",
      "audiences": ["skill-users"],
      "action_required": false
    },
    {
      "type": "added",
      "title": "Autocomplete for release files in your editor",
      "description": "Release files and the config now point to a JSON Schema, so editors like VS Code suggest field names and flag mistakes while you type.",
      "audiences": ["skill-users", "contributors"],
      "action_required": false
    },
    {
      "type": "changed",
      "title": "Releases are drafted faster, with fewer questions",
      "description": "Claude now reads a compact one-line-per-change summary instead of every commit in full, and asks all its questions about impact in one message. If you already gave the version or impact details, it doesn't ask again. When the GitHub CLI is available, pull request titles, descriptions and labels are fetched in a single request.",
      "audiences": ["skill-users"],
      "action_required": false
    },
    {
      "type": "changed",
      "title": "Changes are grouped by pull request",
      "description": "Repositories that use merge commits or squash merges now get one suggested entry per pull request, titled with the pull request's title, instead of one per commit. Previously the pull request titles in merge commits were skipped.",
      "audiences": ["skill-users"],
      "action_required": false
    },
    {
      "type": "changed",
      "title": "Older releases move to yearly archive pages",
      "description": "The main changelog page now shows the latest 20 releases. Older releases are on one page per year, linked at the bottom of every page. Feeds and CHANGELOG.md link to the right page. Links to an older release on the main page now land on the main page without jumping to it; set page_size to 0 in the config to keep everything on one page.",
      "audiences": ["skill-users"],
      "action_required": false
    },
    {
      "type": "changed",
      "title": "Python 3.10 or newer",
      "description": "Shiplog is now tested on Python 3.10 through 3.13. Python 3.8 and 3.9 are no longer supported.",
      "audiences": ["skill-users", "ci-maintainers"],
      "action_required": true,
      "action": "If you run Shiplog or its CI workflow on Python 3.8 or 3.9, switch to Python 3.10 or newer."
    },
    {
      "type": "changed",
      "title": "More helpful validation messages",
      "description": "Validation messages now name the file and the entry title, so problems are easy to find. The validator also warns when the newest release has a deadline that has passed, and when a deprecation doesn't say what to use instead.",
      "audiences": ["skill-users", "ci-maintainers"],
      "action_required": false
    },
    {
      "type": "changed",
      "title": "CI workflow template reads full history and can post to Slack",
      "description": "New workflows fetch the full git history and tags, and include an optional step that announces tagged releases in Slack. Existing workflows keep working. To get the new template and scripts, run the setup again with the force option.",
      "audiences": ["ci-maintainers"],
      "action_required": false
    },
    {
      "type": "fixed",
      "title": "The changelog page no longer changes on every render",
      "description": "Pages used to include the date they were built, so rendering unchanged releases on another day produced a diff. The footer now shows the latest release date, and re-rendering gives identical files.",
      "audiences": ["skill-users", "ci-maintainers"],
      "action_required": false
    },
    {
      "type": "fixed",
      "title": "Better version suggestions",
      "description": "After a pre-release such as 1.2.0-beta.1, the suggested version is now 1.2.0 instead of 1.2.1 or 1.3.0. First releases are suggested as 0.1.0, tags on other branches are ignored, and shallow CI checkouts get a clear message instead of a wrong range.",
      "audiences": ["skill-users", "ci-maintainers"],
      "action_required": false
    },
    {
      "type": "fixed",
      "title": "Fewer false warnings about jargon",
      "description": "Phrases like \"our #1 priority\", product names that contain words such as Hotfix, and standards like UTF-8 or ISO-8601 no longer trigger warnings. You can also list accepted terms in the config.",
      "audiences": ["skill-users"],
      "action_required": false
    }
  ]
}
